{
  "schema_version": 1,
  "model_id": "example-pro-decoder-do-not-admit",
  "model_family": "example_decoder_family",
  "architecture": "decoder_only",
  "parameter_count": 1500000000,
  "quantization": "q4-example",
  "context_length": 8192,
  "tokenizer": "example-tokenizer-do-not-admit",
  "runtime_backend": "webgpu",
  "license": "EXAMPLE_ONLY",
  "license_url": "",
  "source_url": "example-only-no-runtime-url",
  "converted_by": "example-only",
  "conversion_tool": "example-converter",
  "provenance": "Example manifest only. Not reviewed. Do not admit.",
  "review_status": "example_only",
  "contains_private_data": false,
  "total_bytes": 910000000,
  "profile": "pro_static_llm_full",
  "files": [
    {
      "path": "static_llm/assets/example-pro-do-not-admit/model-q4-shard-00001.bin.example",
      "bytes": 64000000,
      "sha256": "example_pro_weights_00001_DO_NOT_ADMIT",
      "role": "weights",
      "required": true
    },
    {
      "path": "static_llm/assets/example-pro-do-not-admit/model-q4-shard-00002.bin.example",
      "bytes": 64000000,
      "sha256": "example_pro_weights_00002_DO_NOT_ADMIT",
      "role": "weights",
      "required": true
    },
    {
      "path": "static_llm/assets/example-pro-do-not-admit/model-q4-shard-00003.bin.example",
      "bytes": 64000000,
      "sha256": "example_pro_weights_00003_DO_NOT_ADMIT",
      "role": "weights",
      "required": true
    },
    {
      "path": "static_llm/assets/example-pro-do-not-admit/model-q4-shard-00004.bin.example",
      "bytes": 64000000,
      "sha256": "example_pro_weights_00004_DO_NOT_ADMIT",
      "role": "weights",
      "required": true
    },
    {
      "path": "static_llm/assets/example-pro-do-not-admit/model-q4-shard-00005.bin.example",
      "bytes": 64000000,
      "sha256": "example_pro_weights_00005_DO_NOT_ADMIT",
      "role": "weights",
      "required": true
    },
    {
      "path": "static_llm/assets/example-pro-do-not-admit/model-q4-shard-00006.bin.example",
      "bytes": 64000000,
      "sha256": "example_pro_weights_00006_DO_NOT_ADMIT",
      "role": "weights",
      "required": true
    },
    {
      "path": "static_llm/assets/example-pro-do-not-admit/model-q4-shard-00007.bin.example",
      "bytes": 64000000,
      "sha256": "example_pro_weights_00007_DO_NOT_ADMIT",
      "role": "weights",
      "required": true
    },
    {
      "path": "static_llm/assets/example-pro-do-not-admit/model-q4-shard-00008.bin.example",
      "bytes": 64000000,
      "sha256": "example_pro_weights_00008_DO_NOT_ADMIT",
      "role": "weights",
      "required": true
    },
    {
      "path": "static_llm/assets/example-pro-do-not-admit/model-q4-shard-00009.bin.example",
      "bytes": 64000000,
      "sha256": "example_pro_weights_00009_DO_NOT_ADMIT",
      "role": "weights",
      "required": true
    },
    {
      "path": "static_llm/assets/example-pro-do-not-admit/model-q4-shard-00010.bin.example",
      "bytes": 64000000,
      "sha256": "example_pro_weights_00010_DO_NOT_ADMIT",
      "role": "weights",
      "required": true
    },
    {
      "path": "static_llm/assets/example-pro-do-not-admit/model-q4-shard-00011.bin.example",
      "bytes": 64000000,
      "sha256": "example_pro_weights_00011_DO_NOT_ADMIT",
      "role": "weights",
      "required": true
    },
    {
      "path": "static_llm/assets/example-pro-do-not-admit/model-q4-shard-00012.bin.example",
      "bytes": 64000000,
      "sha256": "example_pro_weights_00012_DO_NOT_ADMIT",
      "role": "weights",
      "required": true
    },
    {
      "path": "static_llm/assets/example-pro-do-not-admit/model-q4-shard-00013.bin.example",
      "bytes": 64000000,
      "sha256": "example_pro_weights_00013_DO_NOT_ADMIT",
      "role": "weights",
      "required": true
    },
    {
      "path": "static_llm/assets/example-pro-do-not-admit/model-q4-shard-00014.bin.example",
      "bytes": 60000000,
      "sha256": "example_pro_weights_00014_DO_NOT_ADMIT",
      "role": "weights",
      "required": true
    },
    {
      "path": "static_llm/assets/example-pro-do-not-admit/tokenizer.json.example",
      "bytes": 14000000,
      "sha256": "example_pro_tokenizer_DO_NOT_ADMIT",
      "role": "tokenizer",
      "required": true
    },
    {
      "path": "static_llm/assets/example-pro-do-not-admit/config.json.example",
      "bytes": 4000000,
      "sha256": "example_pro_config_DO_NOT_ADMIT",
      "role": "config",
      "required": true
    }
  ],
  "shard_policy": {
    "max_file_bytes": 64000000,
    "target_file_bytes": 32000000,
    "shard_count": 16
  },
  "same_origin_only": true,
  "external_urls_allowed": false,
  "backend_required": false
}
